{"artifactId":"a543ba2e-9cc4-40aa-a2be-f6215f33c714","layers":[{"coordinateFrame":{"units":"pixel-relative","xAxis":"x","yAxis":"y","zAxis":"z"},"layerId":"visible-prime","modality":"visual-symbolic","neutralPlane":0,"projectionRole":"projection-surface","universeId":"prime-projection"}],"schema":"oan.hopng_layer_map","schemaVersion":"0.1.0"}